,Date,Game Location,ID,Tweet,User
0,2019-03-13 02:25:51+00:00,Miami,1105656186349801472,Why no DJ Wilson lately?!,fishbowlmarohl
1,2019-03-15 00:12:55+00:00,Milwaukee,1106347507938938881,honored by all yall inviting me to/sharing with me that DJ Wilson meet n greet event. im good tho if i really wanna stalk his ass i’ll just hit up no. 720,bucksthot
2,2019-03-16 01:58:44+00:00,Milwaukee,1106736526124376066,she's picked DJ FUCKIN WILSON and won the mini fridge. that's AMAZING,travis_mke
3,2019-03-17 20:17:52+00:00,Milwaukee,1107375518897393664,I remember all the jokes from Bucks twitter about DJ Wilson early this season,MarkBiefeld
4,2019-03-21 01:41:58+00:00,Milwaukee,1108544243361034245,"On DJ Wilson: fans wanted him playing do he could have valuable experience and work out the kinks. Rebounds don't matter, his offense will come. If you honestly aren't seeing his potential on defense, I'm not sure what team you're watching",billcanzoneri
5,2019-03-24 20:22:19+00:00,Milwaukee,1109913353504374787,Feeling another DJ Wilson signature game today ,KeyStrokerGrant
6,2019-03-27 01:16:51+00:00,Milwaukee,1110712251777015810,It was just DJ Wilson but yea nice try. Stay off the weed.,CodyRome
