,Date,Game Location,ID,Tweet,User
0,2018-10-04 20:08:24+00:00,Vancouver,1047941526397972480,The Alien. #Canucks #EliasPettersson #EP40 @Rogers Arena https://www.instagram.com/p/BohiUFcnIXmRGbOLUUnHXJXAob170mMxp8Mth40/?utm_source=ig_twitter_share&amp;igshid=54tdr1besg7w,Silent__C
1,2018-10-30 04:24:25+00:00,Vancouver,1057126051934027776,My 7 year old son's new(est) favorite canucks player. Well DUH! #eliaspettersson #40 #canucks @Rogers Arena https://www.instagram.com/p/BpiyruXFvpB/?utm_source=ig_twitter_share&amp;igshid=91cejxkao770,vancouvergolf
2,2018-11-03 03:16:41+00:00,Vancouver,1058558556360728576,NINETEEN YEAR OLD ELIAS PETTERSSON (In my best Jim Hughson voice) ,kaler
3,2018-11-04 04:14:31+00:00,Newark,1058935498083917827,Thanks to these top players in the NHL for using their talents to make hockey great to watch. #hockey #eliaspettersson #vancouvercanucks #patrickkane #chicagoblackhawks #jeffskinner… https://www.instagram.com/p/Bpvp9VlnH-V/?utm_source=ig_twitter_share&amp;igshid=1ab5vsm6laeq1,JamesThomasGoss
4,2018-11-04 04:14:31+00:00,New York,1058935498083917827,Thanks to these top players in the NHL for using their talents to make hockey great to watch. #hockey #eliaspettersson #vancouvercanucks #patrickkane #chicagoblackhawks #jeffskinner… https://www.instagram.com/p/Bpvp9VlnH-V/?utm_source=ig_twitter_share&amp;igshid=1ab5vsm6laeq1,JamesThomasGoss
5,2018-11-04 04:14:31+00:00,New York,1058935498083917827,Thanks to these top players in the NHL for using their talents to make hockey great to watch. #hockey #eliaspettersson #vancouvercanucks #patrickkane #chicagoblackhawks #jeffskinner… https://www.instagram.com/p/Bpvp9VlnH-V/?utm_source=ig_twitter_share&amp;igshid=1ab5vsm6laeq1,JamesThomasGoss
6,2018-12-07 04:35:33+00:00,Vancouver,1070899591036497920,What a goal @_EPettersson !! #canucks #penaltyshot #gocanucksgo #eliaspettersson @Rogers Arena https://www.instagram.com/p/BrEqevkFNWG/?utm_source=ig_twitter_share&amp;igshid=f54rs305t9p7,vancouvergolf
7,2019-01-24 01:32:08+00:00,Vancouver,1088248050123005952,Pre-game beers. #eliaspettersson #roysmancrush @The Alibi Room https://www.instagram.com/p/Bs_7xN8hQxf/?utm_source=ig_twitter_share&amp;igshid=fu9d049g6ew6,leslyleanne
8,2019-02-10 06:31:30+00:00,Vancouver,1094483980018114560,"After that sexy Saturday night hockey game, I couldn't leave without picking up this sexy lil number! My social media $$$bought this!! #Pettersson #ChurchofPetey #EliasPettersson… https://www.instagram.com/p/BtsPjGBh6Ps/?utm_source=ig_twitter_share&amp;igshid=quau8dptkzyk",jenijealousy
9,2019-02-10 15:34:25+00:00,Vancouver,1094620610402017280,The talent... Oh the talent... #eliaspettersson #pettersson #ep40 #brockboeser #boeser #nhl #hockey #vancouver #vancouvercanucks #canucks #icehockey #sweden #canada @Rogers Arena https://www.instagram.com/p/BttNijOBz0V/?utm_source=ig_twitter_share&amp;igshid=10rjedfqtsd6o,kdouchy
10,2019-02-20 02:06:05+00:00,Vancouver,1098041067348389888,"Elias Pettersson, Brock Boeser, Bo Horvat &amp; Antoine Roussel among those joining us on location @CriticPat vancouverbc for canucks Dice &amp; Ice in support of @canucksforkids @Parq Vancouver https://www.instagram.com/p/BuFhH1Jhy-U/?utm_source=ig_twitter_share&amp;igshid=x6995qumvrdb",ScottRintoul
11,2019-03-10 02:51:53+00:00,Vancouver,1104575574326927360,#Canucks⁠ ⁠⁠ ⁠⁠ ⁠⁠ ⁠⁠ ⁠⁠ ⁠⁠ ⁠⁠ ⁠⁠ ⁠⁠ ⁠⁠ ⁠⁠fans! Let's hear your predictions!! Who will score the first Canucks goal tonight against the Vegas Golden Knights? I'll say Elias Pettersson #CanucksFirst,ChrisFaber39
12,2019-03-14 03:18:51+00:00,Ottawa,1106031912621993985,"Weirdest elbow I've ever seen - goes to hit him with his back, arm rides up Pettersson's shoulder and he reverse elbows him in the head. No five-minute penalty if Elias doesn't go down and sell it so much.",grantmccagg
13,2019-03-14 03:51:44+00:00,Pittsburgh,1106040186805387269,"Chris Kreider's raised, flying elbow into Elias Pettersson is one of the ugliest hits all winter in the NHL. He got five and a game, but he should get a hell of a lot more. Not because Pettersson's a star, but because the act was flagrant. #DKPS #Penguins",Dejan_Kovacevic
14,2019-03-14 16:58:21+00:00,Ottawa,1106238147212398592,"Elias Pettersson, the Calder Trophy winner in waiting...has one goal in his last 15 games. Conclusion - must mean he's a slacker. Vancouver should trade him.",grantmccagg
15,2019-03-19 09:08:14+00:00,Vancouver,1107931775291011073,This kid #nhl #hockey #icehockey #vancouver #canucks #vancouvercanucks #eliaspettersson #pettersson #shootout #goal #rookie #calder #caldertrophy #canada #sweden #rogersarena… https://www.instagram.com/p/BvLymjwB70A/?utm_source=ig_twitter_share&amp;igshid=6aj0mswrr3qm,kdouchy
16,2019-03-20 05:00:16+00:00,Vancouver,1108231763220848641,Canucks’ Elias Pettersson is chasing the first Calder Trophy clean sweep since Teemu Selanne https://thehockeynews.com/news/article/canucks-elias-pettersson-is-chasing-the-first-calder-trophy-clean-sweep-since-teemu-selanne via @thehockeynews #Canucks,Canuckoholic
17,2019-03-20 20:09:41+00:00,Vancouver,1108460623921213440,"#congrats #eliaspettersson #bestrookie #mostpoints #vancouvercanucks #@Vancouver, British Columbia https://www.instagram.com/p/BvPjZAchVc2/?utm_source=ig_twitter_share&amp;igshid=1iq9f073phny1",Shaarona29
18,2019-03-20 20:10:48+00:00,Vancouver,1108460903345860609,"#40 #eliaspettersson #bestrookie #vancouvercanucksfanforlife #@Vancouver, British Columbia https://www.instagram.com/p/BvPjhG-hTYj/?utm_source=ig_twitter_share&amp;igshid=1ckcs3iquqle2",Shaarona29
19,2019-03-22 02:17:11+00:00,Edmonton,1108915496189988864,Was checking U21 scoring in the #NHL and to no surprise Elias Pettersson sits atop. What blows me away is that Rasmus Dahlin is 6th as a 18 year old defence man ,KoenPeterson
20,2019-03-29 02:01:39+00:00,Vancouver,1111448301247717377,I’m saying Elias Pettersson gets @Canucks #budlightfirstgoal,sakura_iwagami
21,2019-03-29 03:59:54+00:00,Vancouver,1111478059415166976,Canucks season summed up- Boeser: I really want to thank you #vancouvercanucks #nhl #brockboeser #funnyaf #eliaspettersson #canucks #goal #onehappydude @Vancouver Canucks - Rogers Arena https://www.instagram.com/p/Bvk_kGmB9So/?utm_source=ig_twitter_share&amp;igshid=1kolkuomsgqa4,julieannmcleod
22,2019-03-29 18:47:43+00:00,St. Louis,1111701485887373312,There’s a clear favorite for the NHL’s Calder Trophy (rookie of the year): Elias Pettersson. But has the Blues’ Jordan Binnington done enough to steal the prize? #stlblues #Canucks #LetsGoFlyers,StephenGround
23,2019-03-30 14:28:58+00:00,Vancouver,1111998757015601153,After Hours from Vancouver: Guests are Tyler Seguin followed by Josh Leivo with a brief appearance by Elias Pettersson. Do you have questions? #afterhours,ScottOake
24,2019-04-02 23:21:04+00:00,Vancouver,1113219829408784384,My #Canucks Awards picks: Unsung Hero: Antoine Roussel Best D-man: Alex Edler Most Exciting Player: Elias Pettersson MVP: Jacob Markstrom Write in award: Most Improved Player: Troy Stecher,RandipJanda
25,2019-04-05 23:13:47+00:00,Vancouver,1114305159868248065,Your 2019 Calder Trophy winner: Elias Pettersson. #NHL,RandipJanda
